Warehouse_forecasting/warehouse_forecasting_results.csv

model,MAE,RMSE,MAPE_percent
Persistence,18.53305917328137,30.05432017636659,5.341929798359594
Previous-day same-hour,24.737525596589556,36.03238386980224,7.246933665769288
24-hour mean,33.87714007135387,41.56322675336016,9.937656074405291
Attention,18.54618347773199,26.575318625019168,5.297320016610806

README.md

## Base test results

Model                          MAE      RMSE    MAPE
  ------------------------ --------- --------- -------
  Persistence                18.5331   30.0543   5.34%
  Previous-day same-hour     24.7375   36.0324   7.25%
  24-hour mean               33.8771   41.5632   9.94%
  Attention                  18.5462   26.5753   5.30%